{
  "schema_version": 2,
  "id": "translation-controlled-en-de-v2",
  "task_class": "language.translation-controlled",
  "instruction": "Read input.json and translate each source segment from source_locale to target_locale. Obey every required_glossary value as the required lexical choice and preserve every protected_tokens value exactly, including case, punctuation, digits, spaces, and UTC. Do not translate opaque identifiers. Write translation.json only. Output exactly schema_version, source_locale, target_locale, and translations. schema_version must be 1. translations must be an array in the same segment order; each entry must contain exactly id and text. Do not add explanations or any other file.",
  "fixture": "fixture",
  "verifier": "verify.py",
  "limits": {
    "wall_seconds": 120
  },
  "success": {
    "kind": "deterministic-controlled-reference-plus-protected-token-verifier"
  },
  "allowed_write_paths": [
    "translation.json"
  ],
  "projected_tools": [
    "read_file",
    "write_file"
  ],
  "demands": {
    "novelty": "low",
    "ambiguity": "low",
    "planning_horizon": "short",
    "tool_discovery": "low",
    "recovery_requirement": "low",
    "context_volume": "small",
    "environment_uncertainty": "low",
    "verification_strength": "exact-controlled-reference"
  },
  "ksa_requirements": [
    {
      "family": "skills",
      "name": "controlled_cross_lingual_meaning_transfer",
      "evidence_role": "composite"
    },
    {
      "family": "abilities",
      "name": "protected_token_preservation",
      "evidence_role": "isolating"
    },
    {
      "family": "abilities",
      "name": "structured_output_discipline",
      "evidence_role": "supporting"
    }
  ],
  "demand_factors": {
    "source_segments": 4,
    "protected_tokens": 11,
    "target_locale": "de-DE",
    "required_glossary_entries": 8,
    "allowed_output_files": 1
  }
}
